{
	"$schema": "../../schema/entry.schema.json",
	"schemaVersion": 1,
	"title": "Moog Ladder Filter",
	"summary": "The transistor ladder filter of the Minimoog: a university lecture analyzing how the ladder works, Tim Stinchcombe's mathematical analysis of the ladder and its derivatives, and René Schmitz's buildable version of the Minimoog filter with notes on common pitfalls.",
	"manufacturers": [
		"moog"
	],
	"products": [
		"minimoog"
	],
	"circuitTypes": [
		"filter"
	],
	"subcircuits": [
		"ladder_filter",
		"differential_pair",
		"feedback_network",
		"exponential_converter"
	],
	"functions": [
		"lowpass_response",
		"resonance_control",
		"self_oscillation",
		"voltage_controlled_cutoff"
	],
	"difficulty": "advanced",
	"confidence": "academic",
	"added": "2026-09-26",
	"sources": [
		{
			"type": "video",
			"title": "ECE4450 L22: Moog Ladder Filters Analyzed",
			"url": "https://www.youtube.com/watch?v=IRxeIEeAAnU",
			"author": "Aaron Lanterman (Georgia Tech)"
		},
		{
			"type": "paper",
			"title": "Analysis of the Moog Transistor Ladder and Derivative Filters",
			"url": "https://www.timstinchcombe.co.uk/synth/Moog_ladder_tf.pdf",
			"author": "Timothy E. Stinchcombe"
		},
		{
			"type": "schematic",
			"title": "Minimoog Filter: classic four-pole lowpass",
			"url": "https://www.schmitzbits.de/filter.html",
			"author": "René Schmitz"
		}
	]
}
