{
	"$schema": "../../schema/entry.schema.json",
	"schemaVersion": 1,
	"title": "An Analog Circuit That Can Sound Like Any Drum",
	"summary": "Video on a flexible analog drum voice that can be tuned to cover many different drum sounds.",
	"circuitTypes": [
		"drum"
	],
	"subcircuits": [
		"drum_voice"
	],
	"functions": [
		"drum_synthesis"
	],
	"difficulty": "intermediate",
	"confidence": "community-verified",
	"added": "2026-09-26",
	"sources": [
		{
			"type": "video",
			"title": "This analog circuit can sound like any drum",
			"url": "https://www.youtube.com/watch?v=Xbl1xwFR3eg",
			"author": "Moritz Klein"
		}
	]
}
