{
	"$schema": "../../schema/entry.schema.json",
	"schemaVersion": 1,
	"title": "A \"Graphic-Wave\" LFO",
	"summary": "Designing an LFO whose waveform is drawn with a row of sliders, like a graphic EQ: choosing the chip, an 8-point first version, then more points and interpolation, and why the result is close to a sequencer.",
	"circuitTypes": [
		"lfo"
	],
	"subcircuits": [
		"microcontroller"
	],
	"functions": [
		"periodic_modulation",
		"tap_tempo"
	],
	"ics": [
		"pic"
	],
	"difficulty": "intermediate",
	"confidence": "community",
	"added": "2026-09-26",
	"sources": [
		{
			"type": "website",
			"title": "A \"Graphic-wave\" LFO",
			"url": "https://electricdruid.net/a-graphic-wave-lfo/",
			"author": "Tom Wiltshire (Electric Druid)",
			"year": 2023,
			"license": "CC BY-NC-SA 4.0"
		}
	]
}
