{
	"$schema": "../../schema/entry.schema.json",
	"schemaVersion": 1,
	"title": "Discrete ADSR Envelope Generator",
	"summary": "A discrete-transistor ADSR expanded from Barry Klein's AD envelope design, with build notes.",
	"circuitTypes": [
		"envelope"
	],
	"functions": [
		"envelope_generation"
	],
	"difficulty": "beginner",
	"confidence": "community-verified",
	"added": "2026-09-26",
	"sources": [
		{
			"type": "schematic",
			"title": "Envelope Generator ADSR",
			"url": "https://www.schmitzbits.de/adsr.html",
			"author": "René Schmitz"
		}
	]
}
