{
	"$schema": "../../schema/entry.schema.json",
	"schemaVersion": 1,
	"title": "Adding Vintage Hiss, Crackle and Pop",
	"summary": "A circuit that deliberately generates vinyl-style background noise (hiss, crackle and pops) to make recordings sound old.",
	"circuitTypes": [
		"noise",
		"fx"
	],
	"subcircuits": [
		"noise_generator",
		"microcontroller"
	],
	"functions": [
		"noise_generation",
		"random_modulation"
	],
	"ics": [
		"pic"
	],
	"difficulty": "intermediate",
	"confidence": "community",
	"added": "2026-09-26",
	"sources": [
		{
			"type": "website",
			"title": "Adding Vintage Hiss, Crackle, and Pop!",
			"url": "https://electricdruid.net/adding-vintage-hiss-crackle-and-pop/",
			"author": "Tom Wiltshire (Electric Druid)",
			"year": 2017,
			"license": "CC BY-NC-SA 4.0"
		}
	]
}
