{
	"$schema": "../../schema/entry.schema.json",
	"schemaVersion": 1,
	"title": "Noise Reduction with Companders",
	"summary": "How a compander quiets noisy effects like BBD or PT2399 delays: compress before the effect, expand after it. Uses the SA571/NE571.",
	"circuitTypes": [
		"fx",
		"utility"
	],
	"subcircuits": [
		"compander",
		"bbd_delay_line"
	],
	"functions": [
		"noise_reduction"
	],
	"ics": [
		"sa571",
		"pt2399"
	],
	"difficulty": "beginner",
	"confidence": "community-verified",
	"added": "2026-09-26",
	"sources": [
		{
			"type": "website",
			"title": "Noise Reduction with Companders",
			"url": "https://electricdruid.net/noise-reduction-with-companders/",
			"author": "Tom Wiltshire (Electric Druid)",
			"year": 2016,
			"license": "CC BY-NC-SA 4.0"
		}
	]
}
