{
	"$schema": "../../schema/entry.schema.json",
	"schemaVersion": 1,
	"title": "Integrator-Based VCO with Triangle and Sine (VCO 3)",
	"summary": "An integrator-based VCO from 1998 with triangle and sine outputs, inspired by designs discussed on the Synth-DIY mailing list; uses an LM394 matched pair.",
	"circuitTypes": [
		"oscillator"
	],
	"subcircuits": [
		"vco_core",
		"integrator",
		"exponential_converter",
		"waveshaper"
	],
	"functions": [
		"exponential_response",
		"waveshaping"
	],
	"ics": [
		"lm394"
	],
	"difficulty": "intermediate",
	"confidence": "community-verified",
	"added": "2026-09-26",
	"sources": [
		{
			"type": "schematic",
			"title": "VCO 3",
			"url": "https://www.schmitzbits.de/vco3.html",
			"author": "René Schmitz"
		}
	]
}
