{
	"$schema": "../../schema/entry.schema.json",
	"schemaVersion": 1,
	"title": "RC Filter Calculator",
	"summary": "Online calculator for simple RC filters: enter two of resistance, capacitance and cutoff frequency to get the third.",
	"circuitTypes": [
		"filter",
		"utility"
	],
	"subcircuits": [
		"rc_lowpass",
		"rc_highpass"
	],
	"functions": [
		"lowpass_response",
		"highpass_response"
	],
	"difficulty": "beginner",
	"confidence": "community",
	"added": "2026-09-26",
	"sources": [
		{
			"type": "website",
			"title": "RC Filter Calculator",
			"url": "https://electricdruid.net/rc-filter-calc/",
			"author": "Tom Wiltshire (Electric Druid)",
			"year": 2017,
			"license": "CC BY-NC-SA 4.0"
		}
	]
}
