{
	"$schema": "../../schema/entry.schema.json",
	"schemaVersion": 1,
	"title": "Flangelicious Flanger",
	"summary": "Flanger pedal that avoids the usual chip count by generating the LFO-modulated BBD clock directly from a microcontroller. Two versions: a classic four-knob flanger and an experimental multi-waveform one.",
	"circuitTypes": [
		"fx"
	],
	"subcircuits": [
		"bbd_delay_line",
		"clock_generator",
		"microcontroller"
	],
	"functions": [
		"chorus_flanging",
		"periodic_modulation"
	],
	"ics": [
		"mn3007",
		"pic"
	],
	"difficulty": "intermediate",
	"confidence": "community",
	"added": "2026-09-26",
	"sources": [
		{
			"type": "website",
			"title": "Flangelicious – A super-dooper flanger",
			"url": "https://electricdruid.net/flangelicious-a-super-dooper-flanger/",
			"author": "Tom Wiltshire (Electric Druid)",
			"year": 2016,
			"license": "CC BY-NC-SA 4.0"
		}
	]
}
