{
	"$schema": "../../schema/entry.schema.json",
	"schemaVersion": 1,
	"title": "CEM3320 and SSM2044 Filter Designs in Classic Synths",
	"summary": "Comparison of how various classic synths wired the CEM3320 and SSM2044 filter chips, using the datasheet application circuits as reference: input scaling, resonance feedback, CV summing and temperature compensation of the exponential converter.",
	"manufacturers": ["sequential", "korg"],
	"products": ["prophet-5", "pro-one"],
	"circuitTypes": ["filter"],
	"subcircuits": ["ota_stage", "feedback_network", "exponential_converter", "inverting_amp"],
	"functions": ["resonance_control", "voltage_controlled_cutoff", "exponential_response", "temperature_compensation", "lowpass_response"],
	"ics": ["cem3320", "ssm2044"],
	"difficulty": "intermediate",
	"confidence": "community-verified",
	"added": "2026-09-26",
	"sources": [
		{
			"type": "website",
			"title": "CEM3320 Filter designs",
			"url": "https://electricdruid.net/cem3320-filter-designs/",
			"author": "Tom Wiltshire (Electric Druid)",
			"license": "CC BY-NC-SA 4.0"
		},
		{
			"type": "website",
			"title": "SSM2044 LP Filter designs",
			"url": "https://electricdruid.net/ssm2044-lp-filter-designs/",
			"author": "Tom Wiltshire (Electric Druid)",
			"license": "CC BY-NC-SA 4.0"
		}
	]
}
