{
	"$schema": "../../schema/entry.schema.json",
	"schemaVersion": 1,
	"title": "PC Parallel-Port CV Interface",
	"summary": "A CV interface driven from a PC parallel port as an alternative to MIDI-to-CV converters. The PC software is obsolete (Windows 98/ME), but the hardware idea is still documented.",
	"circuitTypes": [
		"utility"
	],
	"subcircuits": [
		"dac_output"
	],
	"functions": [
		"clock_conversion"
	],
	"difficulty": "intermediate",
	"confidence": "community",
	"added": "2026-09-26",
	"sources": [
		{
			"type": "schematic",
			"title": "Control Voltage Interface",
			"url": "https://www.schmitzbits.de/cvmidi.html",
			"author": "René Schmitz"
		}
	]
}
